{
  "id": "jonathan",
  "name": "Jonathan",
  "aliases": ["Yonatan", "Saul's Son", "David's Friend"],
  "quotes": {
    "soul-knit": {
      "source": "1 Samuel 18:1",
      "context": "Beginning of David and Jonathan's friendship",
      "hebrew": "וְנֶפֶשׁ יְהוֹנָתָן נִקְשְׁרָה בְּנֶפֶשׁ דָּוִד",
      "english": "The soul of Jonathan was knit to the soul of David",
      "mood": "deep connection, soul-level bond"
    },
    "nothing-hinders": {
      "source": "1 Samuel 14:6",
      "context": "Before attacking the Philistine garrison alone",
      "hebrew": "אֵין לַיהוָה מַעְצוֹר לְהוֹשִׁיעַ בְּרַב אוֹ בִמְעָט",
      "english": "Nothing can hinder the LORD from saving by many or by few",
      "mood": "impossible faith, warrior courage"
    },
    "go-in-peace": {
      "source": "1 Samuel 20:42",
      "context": "Jonathan's farewell to David",
      "hebrew": "לֵךְ לְשָׁלוֹם... יְהוָה יִהְיֶה בֵּינִי וּבֵינֶךָ",
      "english": "Go in peace, for we have sworn friendship in the name of the LORD",
      "mood": "blessed farewell, covenant friendship"
    },
    "why-should-he-die": {
      "source": "1 Samuel 20:32",
      "context": "Defending David to Saul",
      "hebrew": "לָמָּה יוּמָת מֶה עָשָׂה",
      "english": "Why should he be put to death? What has he done?",
      "mood": "moral courage, defending innocence"
    },
    "how-mighty-fallen": {
      "source": "2 Samuel 1:25-26",
      "context": "David's lament for Jonathan",
      "hebrew": "אֵיךְ נָפְלוּ גִבּוֹרִים",
      "english": "How the mighty have fallen... Your love was more wonderful to me than the love of women",
      "mood": "grief, transcendent love"
    },
    "you-shall-be-king": {
      "source": "1 Samuel 23:17",
      "context": "Jonathan's final words to David",
      "hebrew": "וְאַתָּה תִּמְלֹךְ עַל יִשְׂרָאֵל",
      "english": "You shall be king over Israel, and I shall be next to you",
      "mood": "selfless acceptance, humble loyalty"
    }
  }
}
